{
  "schema_version": "1.0",
  "message_type": "openclaw_command_envelope",
  "created_at": "2026-07-18T10:05:00Z",
  "safety_flags": {
    "synthetic_local_only": true,
    "mock_only": true,
    "dry_run": true,
    "owner_review_required": true,
    "external_side_effects_allowed": false,
    "external_side_effects_occurred": false,
    "blackboard_write_allowed": false,
    "queue_write_allowed": false,
    "audit_trail_write_allowed": false,
    "worker_dispatch_allowed": false,
    "openclaw_call_allowed": false,
    "hermes_runtime_allowed": false,
    "connector_call_allowed": false,
    "google_sheets_write_allowed": false,
    "follow_up_allowed": false,
    "follow_up_requires_owner_confirmation": true
  },
  "prev_entry_hash": "eeeeeeeeeeeeeeeeeeeeeeeeeeeeeeeeeeeeeeeeeeeeeeeeeeeeeeeeeeeeeeee",
  "execution_class": "AUTO",
  "produced_by": "command-envelope-preview",
  "parent_task_id": null,
  "role": "single_worker_preview",
  "command_id": "cmd-phase3-001",
  "task_id": "task-phase3-001",
  "dry_run_id": "dryrun-phase3-001",
  "target_runtime": "openclaw_mock",
  "task_type": "query",
  "input_summary": "Return a harmless synthetic status summary.",
  "allowed_tools": [],
  "denied_tools": [
    "filesystem_write",
    "connector_call",
    "external_message_send"
  ],
  "idempotency_key": "phase3-task-001-command-001",
  "execution_mode": "mock_only",
  "validation_status": "validated_preview"
}
